06:23:12.267566 IP 59.233.235.218.39247 > 59.233.235.223.12121: Flags [S], seq 2635601089, win 14600, options [mss 1460,sackOK,TS val 18592800 ecr 0,nop,wscale 7], length 0
E..<..@.@.J>;...;....O/Y..........9............
... ........
06:23:12.267694 IP 59.233.235.223.12121 > 59.233.235.218.39247: Flags [S.], seq 3131636289, ack 2635601090, win 14480, options [mss 1460,sackOK,TS val 46280417 ecr 18592800,nop,wscale 5], length 0
E..<..@.@../;...;.../Y.O...A......8............
....... ....
06:23:12.267956 IP 59.233.235.218.39247 > 59.233.235.223.12121: Flags [.], ack 1, win 115, options [nop,nop,TS val 18592800 ecr 46280417], length 0
E..4..@.@.JE;...;....O/Y.......B...s.p.....
... ....
06:23:12.303574 IP 59.233.235.223.12121 > 59.233.235.218.39247: Flags [P.], seq 1:4, ack 1, win 453, options [nop,nop,TS val 46280426 ecr 18592800], length 3
E..7..@.@...;...;.../Y.O...B...............
....... ..%
06:23:12.303821 IP 59.233.235.218.39247 > 59.233.235.223.12121: Flags [.], ack 4, win 115, options [nop,nop,TS val 18592804 ecr 46280426], length 0
E..4..@.@.JD;...;....O/Y.......E...s.`.....
...$....
06:23:12.303842 IP 59.233.235.218.39247 > 59.233.235.223.12121: Flags [P.], seq 1:4, ack 4, win 115, options [nop,nop,TS val 18592804 ecr 46280426], length 3
E..7..@.@.J@;...;....O/Y.......E...s.W.....
...$......%
06:23:12.303962 IP 59.233.235.223.12121 > 59.233.235.218.39247: Flags [.], ack 4, win 453, options [nop,nop,TS val 46280426 ecr 18592804], length 0
E..4..@.@...;...;.../Y.O...E...............
.......$
06:23:12.304147 IP 59.233.235.223.12121 > 59.233.235.218.39247: Flags [P.], seq 4:22, ack 4, win 453, options [nop,nop,TS val 46280426 ecr 18592804], length 18
E..F..@.@...;...;.../Y.O...E...............
.......$..&..... ..#..'..$
06:23:12.304264 IP 59.233.235.218.39247 > 59.233.235.223.12121: Flags [P.], seq 4:22, ack 22, win 115, options [nop,nop,TS val 18592804 ecr 46280426], length 18
E..F..@.@.J0;...;....O/Y.......W...s.......
...$......&..... ..#..'..$
06:23:12.304425 IP 59.233.235.223.12121 > 59.233.235.218.39247: Flags [P.], seq 22:46, ack 22, win 453, options [nop,nop,TS val 46280426 ecr 18592804], length 24
E..L..@.@..y;...;.../Y.O...W...............
.......$.. .....#.....'.........
06:23:12.304605 IP 59.233.235.218.39247 > 59.233.235.223.12121: Flags [P.], seq 22:89, ack 46, win 115, options [nop,nop,TS val 18592804 ecr 46280426], length 67
E..w..@.@.I.;...;....O/Y.......o...s.......
...$...... .38400,38400....#.SodaCan:0....'..DISPLAY.SodaCan:0......xterm..
06:23:12.306736 IP 59.233.235.223.12121 > 59.233.235.218.39247: Flags [P.], seq 46:64, ack 89, win 453, options [nop,nop,TS val 46280427 ecr 18592804], length 18
E..F..@.@..~;...;.../Y.O...o.........9.....
.......$........"........!
06:23:12.306958 IP 59.233.235.218.39247 > 59.233.235.223.12121: Flags [P.], seq 89:163, ack 64, win 115, options [nop,nop,TS val 18592804 ecr 46280427], length 74
E..~..@.@.I.;...;....O/Y...........sES.....
...$............"..".....b........b....	B.
..............................1.......!
06:23:12.307270 IP 59.233.235.223.12121 > 59.233.235.218.39247: Flags [P.], seq 64:71, ack 163, win 453, options [nop,nop,TS val 46280427 ecr 18592804], length 7
E..;..@.@...;...;.../Y.O.......d.....#.....
.......$.."....
06:23:12.307408 IP 59.233.235.218.39247 > 59.233.235.223.12121: Flags [P.], seq 163:170, ack 71, win 115, options [nop,nop,TS val 18592804 ecr 46280427], length 7
E..;..@.@.J8;...;....O/Y...d.......s.n.....
...$......"....
06:23:12.307704 IP 59.233.235.223.12121 > 59.233.235.218.39247: Flags [P.], seq 71:86, ack 170, win 453, options [nop,nop,TS val 46280427 ecr 18592804], length 15
E..C..@.@...;...;.../Y.O.......k...........
.......$..!..........."
06:23:12.307843 IP 59.233.235.218.39247 > 59.233.235.223.12121: Flags [P.], seq 170:179, ack 86, win 115, options [nop,nop,TS val 18592804 ecr 46280427], length 9
E..=..@.@.J5;...;....O/Y...k.......s.W.....
...$............"
06:23:12.308016 IP 59.233.235.223.12121 > 59.233.235.218.39247: Flags [P.], seq 86:127, ack 179, win 453, options [nop,nop,TS val 46280427 ecr 18592804], length 41
E..]..@.@..d;...;.../Y.O.......t....[a.....
.......$..".............	..
.....................
06:23:12.339309 IP 59.233.235.218.39247 > 59.233.235.223.12121: Flags [.], ack 127, win 115, options [nop,nop,TS val 18592808 ecr 46280427], length 0
E..4..@.@.J=;...;....O/Y...t.......s.......
...(....
06:23:12.339391 IP 59.233.235.223.12121 > 59.233.235.218.39247: Flags [P.], seq 127:202, ack 179, win 453, options [nop,nop,TS val 46280435 ecr 18592808], length 75
E.....@.@..A;...;.../Y.O.......t....K......
.......(
Linux 2.6.38-8-generic-pae (::ffff:10.1.1.2) (pts/10)

..wwwbugs login: 
06:23:12.339542 IP 59.233.235.218.39247 > 59.233.235.223.12121: Flags [.], ack 202, win 115, options [nop,nop,TS val 18592808 ecr 46280435], length 0
E..4..@.@.J<;...;....O/Y...t.......s.......
...(....
06:23:24.491452 IP 59.233.235.218.39247 > 59.233.235.223.12121: Flags [P.], seq 179:180, ack 202, win 115, options [nop,nop,TS val 18594023 ecr 46280435], length 1
E..5..@.@.J:;...;....O/Y...t.......s.......
........l
06:23:24.496998 IP 59.233.235.223.12121 > 59.233.235.218.39247: Flags [P.], seq 202:204, ack 180, win 453, options [nop,nop,TS val 46283475 ecr 18594023], length 2
E..6..@.@...;...;.../Y.O.......u.....r.....
..:......l
06:23:24.497158 IP 59.233.235.218.39247 > 59.233.235.223.12121: Flags [.], ack 204, win 115, options [nop,nop,TS val 18594023 ecr 46283475], length 0
E..4..@.@.J:;...;....O/Y...u......s.8.....
......:.
06:23:24.591456 IP 59.233.235.218.39247 > 59.233.235.223.12121: Flags [P.], seq 180:181, ack 204, win 115, options [nop,nop,TS val 18594033 ecr 46283475], length 1
E..5..@.@.J8;...;....O/Y...u......s.%.....
......:.e
06:23:24.597002 IP 59.233.235.223.12121 > 59.233.235.218.39247: Flags [P.], seq 204:206, ack 181, win 453, options [nop,nop,TS val 46283500 ecr 18594033], length 2
E..6..@.@...;...;.../Y.O......v.....S.....
..:......e
06:23:24.597220 IP 59.233.235.218.39247 > 59.233.235.223.12121: Flags [.], ack 206, win 115, options [nop,nop,TS val 18594033 ecr 46283500], length 0
E..4..@.@.J8;...;....O/Y...v.......s.......
......:.
06:23:24.821113 IP 59.233.235.218.39247 > 59.233.235.223.12121: Flags [P.], seq 181:182, ack 206, win 115, options [nop,nop,TS val 18594056 ecr 46283500], length 1
E..5..@.@.J6;...;....O/Y...v.......s.......
......:.v
06:23:24.828963 IP 59.233.235.223.12121 > 59.233.235.218.39247: Flags [P.], seq 206:208, ack 182, win 453, options [nop,nop,TS val 46283558 ecr 18594056], length 2
E..6..@.@...;...;.../Y.O.......w...........
..;&.....v
06:23:24.829099 IP 59.233.235.218.39247 > 59.233.235.223.12121: Flags [.], ack 208, win 115, options [nop,nop,TS val 18594056 ecr 46283558], length 0
E..4..@.@.J6;...;....O/Y...w.......s.......
......;&
06:23:24.911733 IP 59.233.235.218.39247 > 59.233.235.223.12121: Flags [P.], seq 182:183, ack 208, win 115, options [nop,nop,TS val 18594065 ecr 46283558], length 1
E..5..@.@.J4;...;....O/Y...w.......s.......
......;&e
06:23:24.916960 IP 59.233.235.223.12121 > 59.233.235.218.39247: Flags [P.], seq 208:210, ack 183, win 453, options [nop,nop,TS val 46283580 ecr 18594065], length 2
E..6..@.@...;...;.../Y.O.......x...........
..;<.....e
06:23:24.917093 IP 59.233.235.218.39247 > 59.233.235.223.12121: Flags [.], ack 210, win 115, options [nop,nop,TS val 18594065 ecr 46283580], length 0
E..4..@.@.J4;...;....O/Y...x.......s.......
......;<
06:23:24.981645 IP 59.233.235.218.39247 > 59.233.235.223.12121: Flags [P.], seq 183:184, ack 210, win 115, options [nop,nop,TS val 18594072 ecr 46283580], length 1
E..5..@.@.J2;...;....O/Y...x.......s.......
......;<l
06:23:24.988957 IP 59.233.235.223.12121 > 59.233.235.218.39247: Flags [P.], seq 210:212, ack 184, win 453, options [nop,nop,TS val 46283598 ecr 18594072], length 2
E..6..@.@...;...;.../Y.O.......y...........
..;N.....l
06:23:24.989096 IP 59.233.235.218.39247 > 59.233.235.223.12121: Flags [.], ack 212, win 115, options [nop,nop,TS val 18594072 ecr 46283598], length 0
E..4..@.@.J2;...;....O/Y...y.......s.......
......;N
06:23:25.311494 IP 59.233.235.218.39247 > 59.233.235.223.12121: Flags [P.], seq 184:185, ack 212, win 115, options [nop,nop,TS val 18594105 ecr 46283598], length 1
E..5..@.@.J0;...;....O/Y...y.......s.V.....
...9..;NX
06:23:25.317086 IP 59.233.235.223.12121 > 59.233.235.218.39247: Flags [P.], seq 212:214, ack 185, win 453, options [nop,nop,TS val 46283680 ecr 18594105], length 2
E..6..@.@...;...;.../Y.O.......z.....X.....
..;....9.X
06:23:25.317328 IP 59.233.235.218.39247 > 59.233.235.223.12121: Flags [.], ack 214, win 115, options [nop,nop,TS val 18594105 ecr 46283680], length 0
E..4..@.@.J0;...;....O/Y...z.......s.
.....
...9..;.
06:23:26.091422 IP 59.233.235.218.39247 > 59.233.235.223.12121: Flags [P.], seq 185:186, ack 214, win 115, options [nop,nop,TS val 18594183 ecr 46283680], length 1
E..5..@.@.J.;...;....O/Y...z.......s.......
......;.
06:23:26.094869 IP 59.233.235.223.12121 > 59.233.235.218.39247: Flags [P.], seq 214:215, ack 186, win 453, options [nop,nop,TS val 46283874 ecr 18594183], length 1
E..5..@.@...;...;.../Y.O.......{...........
..<b.....
06:23:26.095123 IP 59.233.235.218.39247 > 59.233.235.223.12121: Flags [.], ack 215, win 115, options [nop,nop,TS val 18594183 ecr 46283874], length 0
E..4..@.@.J.;...;....O/Y...{.......s.......
......<b
06:23:26.095219 IP 59.233.235.223.12121 > 59.233.235.218.39247: Flags [P.], seq 215:228, ack 186, win 453, options [nop,nop,TS val 46283874 ecr 18594183], length 13
E..A..@.@..w;...;.../Y.O.......{....'......
..<b.....
Password: 
06:23:26.095329 IP 59.233.235.218.39247 > 59.233.235.223.12121: Flags [.], ack 228, win 115, options [nop,nop,TS val 18594183 ecr 46283874], length 0
E..4..@.@.J-;...;....O/Y...{...%...s.......
......<b
06:23:34.363418 IP 59.233.235.218.39247 > 59.233.235.223.12121: Flags [P.], seq 186:187, ack 228, win 115, options [nop,nop,TS val 18595010 ecr 46283874], length 1
E..5..@.@.J+;...;....O/Y...{...%...s.......
......<bf
06:23:34.400964 IP 59.233.235.223.12121 > 59.233.235.218.39247: Flags [.], ack 187, win 453, options [nop,nop,TS val 46285951 ecr 18595010], length 0
E..4..@.@...;...;.../Y.O...%...|.....@.....
..D.....
06:23:35.253053 IP 59.233.235.218.39247 > 59.233.235.223.12121: Flags [P.], seq 187:188, ack 228, win 115, options [nop,nop,TS val 18595099 ecr 46285951], length 1
E..5..@.@.J*;...;....O/Y...|...%...s|0.....
......D.t
06:23:35.253134 IP 59.233.235.223.12121 > 59.233.235.218.39247: Flags [.], ack 188, win 453, options [nop,nop,TS val 46286164 ecr 18595099], length 0
E..4..@.@...;...;.../Y.O...%...}...........
..ET....
06:23:35.873401 IP 59.233.235.218.39247 > 59.233.235.223.12121: Flags [P.], seq 188:189, ack 228, win 115, options [nop,nop,TS val 18595161 ecr 46286164], length 1
E..5..@.@.J);...;....O/Y...}...%...s.......
...Y..ET_
06:23:35.873472 IP 59.233.235.223.12121 > 59.233.235.218.39247: Flags [.], ack 189, win 453, options [nop,nop,TS val 46286319 ecr 18595161], length 0
E..4..@.@...;...;.../Y.O...%...~.....7.....
..E....Y
06:23:36.343811 IP 59.233.235.218.39247 > 59.233.235.223.12121: Flags [P.], seq 189:190, ack 228, win 115, options [nop,nop,TS val 18595208 ecr 46286319], length 1
E..5..@.@.J(;...;....O/Y...~...%...swQ.....
......E.w
06:23:36.343888 IP 59.233.235.223.12121 > 59.233.235.218.39247: Flags [.], ack 190, win 453, options [nop,nop,TS val 46286436 ecr 18595208], length 0
E..4..@.@...;...;.../Y.O...%...............
..Fd....
06:23:36.573585 IP 59.233.235.218.39247 > 59.233.235.223.12121: Flags [P.], seq 190:191, ack 228, win 115, options [nop,nop,TS val 18595231 ecr 46286436], length 1
E..5..@.@.J';...;....O/Y.......%...s.......
......Fda
06:23:36.573646 IP 59.233.235.223.12121 > 59.233.235.218.39247: Flags [.], ack 191, win 453, options [nop,nop,TS val 46286494 ecr 18595231], length 0
E..4..@.@...;...;.../Y.O...%.........@.....
..F.....
06:23:36.803330 IP 59.233.235.218.39247 > 59.233.235.223.12121: Flags [P.], seq 191:192, ack 228, win 115, options [nop,nop,TS val 18595254 ecr 46286494], length 1
E..5..@.@.J&;...;....O/Y.......%...s.r.....
......F.n
06:23:36.803391 IP 59.233.235.223.12121 > 59.233.235.218.39247: Flags [.], ack 192, win 453, options [nop,nop,TS val 46286551 ecr 18595254], length 0
E..4..@.@..~;...;.../Y.O...%...............
..F.....
06:23:36.943261 IP 59.233.235.218.39247 > 59.233.235.223.12121: Flags [P.], seq 192:193, ack 228, win 115, options [nop,nop,TS val 18595268 ecr 46286551], length 1
E..5..@.@.J%;...;....O/Y.......%...s.*.....
......F.d
06:23:36.943318 IP 59.233.235.223.12121 > 59.233.235.218.39247: Flags [.], ack 193, win 453, options [nop,nop,TS val 46286586 ecr 18595268], length 0
E..4..@.@..};...;.../Y.O...%...............
..F.....
06:23:37.283708 IP 59.233.235.218.39247 > 59.233.235.223.12121: Flags [P.], seq 193:194, ack 228, win 115, options [nop,nop,TS val 18595302 ecr 46286586], length 1
E..5..@.@.J$;...;....O/Y.......%...sz......
......F.r
06:23:37.283783 IP 59.233.235.223.12121 > 59.233.235.218.39247: Flags [.], ack 194, win 453, options [nop,nop,TS val 46286671 ecr 18595302], length 0
E..4..@.@..|;...;.../Y.O...%.........E.....
..GO....
06:23:38.864101 IP 59.233.235.218.39247 > 59.233.235.223.12121: Flags [P.], seq 194:195, ack 228, win 115, options [nop,nop,TS val 18595460 ecr 46286671], length 1
E..5..@.@.J#;...;....O/Y.......%...sl......
......GO.
06:23:38.864181 IP 59.233.235.223.12121 > 59.233.235.218.39247: Flags [.], ack 195, win 453, options [nop,nop,TS val 46287066 ecr 18595460], length 0
E..4..@.@..{;...;.../Y.O...%...............
..H.....
06:23:39.233935 IP 59.233.235.218.39247 > 59.233.235.223.12121: Flags [P.], seq 195:196, ack 228, win 115, options [nop,nop,TS val 18595497 ecr 46287066], length 1
E..5..@.@.J";...;....O/Y.......%...sk?.....
......H..
06:23:39.234016 IP 59.233.235.223.12121 > 59.233.235.218.39247: Flags [.], ack 196, win 453, options [nop,nop,TS val 46287159 ecr 18595497], length 0
E..4..@.@..z;...;.../Y.O...%...............
..I7....
06:23:39.604364 IP 59.233.235.218.39247 > 59.233.235.223.12121: Flags [P.], seq 196:197, ack 228, win 115, options [nop,nop,TS val 18595534 ecr 46287159], length 1
E..5..@.@.J!;...;....O/Y.......%...sj......
......I7.
06:23:39.604414 IP 59.233.235.223.12121 > 59.233.235.218.39247: Flags [.], ack 197, win 453, options [nop,nop,TS val 46287251 ecr 18595534], length 0
E..4..@.@..y;...;.../Y.O...%...............
..I.....
06:23:40.374542 IP 59.233.235.218.39247 > 59.233.235.223.12121: Flags [P.], seq 197:198, ack 228, win 115, options [nop,nop,TS val 18595611 ecr 46287251], length 1
E..5..@.@.J ;...;....O/Y.......%...s.......
......I.N
06:23:40.374620 IP 59.233.235.223.12121 > 59.233.235.218.39247: Flags [.], ack 198, win 453, options [nop,nop,TS val 46287444 ecr 18595611], length 0
E..4..@.@..x;...;.../Y.O...%...............
..JT....
06:23:40.574439 IP 59.233.235.218.39247 > 59.233.235.223.12121: Flags [P.], seq 198:199, ack 228, win 115, options [nop,nop,TS val 18595631 ecr 46287444], length 1
E..5..@.@.J.;...;....O/Y.......%...s.<.....
.../..JTD
06:23:40.574508 IP 59.233.235.223.12121 > 59.233.235.218.39247: Flags [.], ack 199, win 453, options [nop,nop,TS val 46287494 ecr 18595631], length 0
E..4..@.@..w;...;.../Y.O...%...............
..J..../
06:23:42.264451 IP 59.233.235.218.39247 > 59.233.235.223.12121: Flags [P.], seq 199:200, ack 228, win 115, options [nop,nop,TS val 18595800 ecr 46287494], length 1
E..5..@.@.J.;...;....O/Y.......%...s.`.....
......J.R
06:23:42.264529 IP 59.233.235.223.12121 > 59.233.235.218.39247: Flags [.], ack 200, win 453, options [nop,nop,TS val 46287916 ecr 18595800], length 0
E..4..@.@..v;...;.../Y.O...%.........p.....
..L,....
06:23:43.574954 IP 59.233.235.218.39247 > 59.233.235.223.12121: Flags [P.], seq 200:201, ack 228, win 115, options [nop,nop,TS val 18595931 ecr 46287916], length 1
E..5.	@.@.J.;...;....O/Y.......%...s.6.....
...[..L,e
06:23:43.575036 IP 59.233.235.223.12121 > 59.233.235.218.39247: Flags [.], ack 201, win 453, options [nop,nop,TS val 46288244 ecr 18595931], length 0
E..4..@.@..u;...;.../Y.O...%...............
..Mt...[
06:23:44.014684 IP 59.233.235.218.39247 > 59.233.235.223.12121: Flags [P.], seq 201:202, ack 228, win 115, options [nop,nop,TS val 18595975 ecr 46288244], length 1
E..5.
@.@.J.;...;....O/Y.......%...sw......
......Mtl
06:23:44.014742 IP 59.233.235.223.12121 > 59.233.235.218.39247: Flags [.], ack 202, win 453, options [nop,nop,TS val 46288354 ecr 18595975], length 0
E..4..@.@..t;...;.../Y.O...%.........	.....
..M.....
06:23:44.635281 IP 59.233.235.218.39247 > 59.233.235.223.12121: Flags [P.], seq 202:203, ack 228, win 115, options [nop,nop,TS val 18596037 ecr 46288354], length 1
E..5..@.@.J.;...;....O/Y.......%...sd......
......M..
06:23:44.635364 IP 59.233.235.223.12121 > 59.233.235.218.39247: Flags [.], ack 203, win 453, options [nop,nop,TS val 46288509 ecr 18596037], length 0
E..4..@.@..s;...;.../Y.O...%........./.....
..N}....
06:23:44.805020 IP 59.233.235.218.39247 > 59.233.235.223.12121: Flags [P.], seq 203:204, ack 228, win 115, options [nop,nop,TS val 18596054 ecr 46288509], length 1
E..5..@.@.J.;...;....O/Y.......%...s.g.....
......N}L
06:23:44.805072 IP 59.233.235.223.12121 > 59.233.235.218.39247: Flags [.], ack 204, win 453, options [nop,nop,TS val 46288552 ecr 18596054], length 0
E..4..@.@..r;...;.../Y.O...%...............
..N.....
06:23:45.074939 IP 59.233.235.218.39247 > 59.233.235.223.12121: Flags [P.], seq 204:205, ack 228, win 115, options [nop,nop,TS val 18596081 ecr 46288552], length 1
E..5.@.@.J.;...;....O/Y.......%...s. .....
......N.0
06:23:45.074992 IP 59.233.235.223.12121 > 59.233.235.218.39247: Flags [.], ack 205, win 453, options [nop,nop,TS val 46288619 ecr 18596081], length 0
E..4..@.@..q;...;.../Y.O...%...............
..N.....
06:23:45.104894 IP 59.233.235.218.39247 > 59.233.235.223.12121: Flags [P.], seq 205:206, ack 228, win 115, options [nop,nop,TS val 18596084 ecr 46288619], length 1
E..5..@.@.J.;...;....O/Y.......%...s.......
......N.L
06:23:45.104948 IP 59.233.235.223.12121 > 59.233.235.218.39247: Flags [.], ack 206, win 453, options [nop,nop,TS val 46288626 ecr 18596084], length 0
E..4..@.@..p;...;.../Y.O...%...............
..N.....
06:23:45.965233 IP 59.233.235.218.39247 > 59.233.235.223.12121: Flags [P.], seq 206:207, ack 228, win 115, options [nop,nop,TS val 18596170 ecr 46288626], length 1
E..5..@.@.J.;...;....O/Y.......%...s.{.....
...J..N.
06:23:45.965310 IP 59.233.235.223.12121 > 59.233.235.218.39247: Flags [.], ack 207, win 453, options [nop,nop,TS val 46288842 ecr 18596170], length 0
E..4..@.@..o;...;.../Y.O...%.........Y.....
..O....J
06:23:45.972986 IP 59.233.235.223.12121 > 59.233.235.218.39247: Flags [P.], seq 228:231, ack 207, win 453, options [nop,nop,TS val 46288844 ecr 18596170], length 3
E..7..@.@..k;...;.../Y.O...%.........?.....
..O....J.

06:23:45.973182 IP 59.233.235.218.39247 > 59.233.235.223.12121: Flags [.], ack 231, win 115, options [nop,nop,TS val 18596170 ecr 46288844], length 0
E..4..@.@.J.;...;....O/Y.......(...s.......
...J..O.
06:23:48.730070 IP 59.233.235.223.12121 > 59.233.235.218.39247: Flags [P.], seq 231:232, ack 207, win 453, options [nop,nop,TS val 46289533 ecr 18596170], length 1
E..5..@.@..l;...;.../Y.O...(...............
..R}...J.
06:23:48.730327 IP 59.233.235.218.39247 > 59.233.235.223.12121: Flags [.], ack 232, win 115, options [nop,nop,TS val 18596446 ecr 46289533], length 0
E..4..@.@.J.;...;....O/Y.......)...s.......
...^..R}
06:23:48.730424 IP 59.233.235.223.12121 > 59.233.235.218.39247: Flags [P.], seq 232:267, ack 207, win 453, options [nop,nop,TS val 46289533 ecr 18596446], length 35
E..W..@.@..I;...;.../Y.O...)...............
..R}...^.
Login incorrect
wwwbugs login: 
06:23:48.730579 IP 59.233.235.218.39247 > 59.233.235.223.12121: Flags [.], ack 267, win 115, options [nop,nop,TS val 18596446 ecr 46289533], length 0
E..4..@.@.J.;...;....O/Y.......L...s.......
...^..R}
06:23:54.377030 IP 59.233.235.218.39247 > 59.233.235.223.12121: Flags [F.], seq 207, ack 267, win 115, options [nop,nop,TS val 18597011 ecr 46289533], length 0
E..4..@.@.J.;...;....O/Y.......L...s.......
......R}
06:23:54.377594 IP 59.233.235.223.12121 > 59.233.235.218.39247: Flags [F.], seq 267, ack 208, win 453, options [nop,nop,TS val 46290945 ecr 18597011], length 0
E..4..@.@..k;...;.../Y.O...L...............
..X.....
06:23:54.377802 IP 59.233.235.218.39247 > 59.233.235.223.12121: Flags [.], ack 268, win 115, options [nop,nop,TS val 18597011 ecr 46290945], length 0
E..4..@.@.J.;...;....O/Y.......M...s.......
......X.
